marca-id;marca-descr;produto-classe;produto-ean;produto-dun;produto-conservacao;produto-descr
3;BRF - Sadia;Bovinos;7899638366090;;Congelado;Lagarto Sadia Bassi Angus
3;BRF - Sadia;Bovinos;7899638366083;;Congelado;Fralda Sadia Bassi Angus - 1,1kg
4;BRF - Perdigăo;Bovinos;7899638367721;;Resfriado;Patinho Perdigăo Montana
4;BRF - Perdigăo;Bovinos;7899638367660;;Resfriado;Lagarto Perdigăo Montana
4;BRF - Perdigăo;Bovinos;7899638367165;;Congelado;Fralda Perdigăo Montana
4;BRF - Perdigăo;Bovinos;7899638367653;;Resfriado;Fralda Perdigăo Montana - 0,6 a 1,6kg
4;BRF - Perdigăo;Aves;7899638366717;;Resfriado;Patinho Com Gordura Perdigăo na Brasa
4;BRF - Perdigăo;Aves;7899638366489;;Resfriado;Fralda Perdigăo na Brasa
4;BRF - Perdigăo;Aves;7899638366199;;Congelado;Fralda Perdigăo na Brasa
4;BRF - Perdigăo;Aves;7899638366397;;Resfriado;Fralda Com Gordura Perdigăo na Brasa - 0,7 a 1,5kg
3;BRF - Sadia;Aves;7899638349130;;Resfriado;Maminha Wagyu Importado Tacuarembó
3;BRF - Sadia;Bovinos;7899638349284;;Congelado;Coraçăo Da Paleta Wagyu Importado Tacuarembó - 3,3kg
3;BRF - Sadia;Bovinos;7899638349291;;Congelado;Coxăo Mole Wagyu Importado Tacuarembó - 6kg
4;BRF - Perdigăo;Bovinos;7899638367882;;Congelado;Costela Do Traseiro Tiras Iwp Perdigăo Montana
3;BRF - Sadia;Bovinos;7899638349123;;Congelado;Coraçăo Da Alcatra Wagyu Importado Tacuarembó
3;BRF - Sadia;Bovinos;7899638341004;;Congelado;Coxăo Duro Wagyu Importado Tacuarembó - 5,5kg
3;BRF - Sadia;Bovinos;7899638365772;;Resfriado;Coraçăo Da Paleta Resfriado Sadia Bassi Angus
3;BRF - Sadia;Bovinos;7899638365789;;Resfriado;Coraçăo Da Paleta Sadia Bassi Angus
4;BRF - Perdigăo;Aves;7899638366908;;Congelado;Filé de Costela Bife Perdigăo na Brasa - 150 a 160g
4;BRF - Perdigăo;Aves;7899638366571;;Resfriado;Costela Do Traseiro Minga Perdigăo na Brasa
3;BRF - Sadia;Bovinos;7899638365840;;Congelado;Filé de Costela Sem Aba Sadia Bassi Angus - 2,5kg
3;BRF - Sadia;Bovinos;7899638365697;;Resfriado;Coxăo Duro Resfriado Sadia Bassi Angus
4;BRF - Perdigăo;Bovinos;7899638367080;;Congelado;Costela Do Traseiro Minga Perdigăo Montana
4;BRF - Perdigăo;Aves;7899638366595;;Resfriado;Coxăo Duro Perdigăo na Brasa - 2,5 a 3kg
3;BRF - Sadia;Bovinos;7899638366052;;Congelado;Costela Do Traseiro Minga Sadia Bassi Angus
4;BRF - Perdigăo;Bovinos;7899638367134;;Congelado;Cupim Perdigăo Montana - 1 a 3kg
3;BRF - Sadia;Bovinos;7899638365833;;Congelado;Filé de Costela Com Aba Sadia Bassi Angus - 2,5kg
3;BRF - Sadia;Bovinos;7899638347075;;Congelado;Cupim B Congelado Palatare - 0,7 a 3kg
4;BRF - Perdigăo;Bovinos;7899638367813;;Resfriado;Coxăo Duro Resfriado Perdigăo Montana
3;BRF - Sadia;Bovinos;7899638366069;;Congelado;Coxăo Duro Congelado Sadia Bassi Angus
4;BRF - Perdigăo;Aves;7899638366298;;Congelado;Costela Do Traseiro Minga Perdigăo na Brasa - 6,5 a 9,5kg
3;BRF - Sadia;Bovinos;7899638338042;;Resfriado;Cupim B Resfriado Palatare
4;BRF - Perdigăo;Bovinos;7899638367110;;Congelado;Coxăo Duro Congelado Perdigăo Montana
4;BRF - Perdigăo;Aves;7899638366304;;Congelado;Costela Do Traseiro Minga Sem Osso Perdigăo na Brasa - 2 a 4kg
4;BRF - Perdigăo;Bovinos;7899638367141;;Congelado;Cupim Perdigăo Montana
4;BRF - Perdigăo;Aves;7899638366250;;Congelado;Cupim Perdigăo na Brasa
3;BRF - Sadia;Bovinos;7899638340076;;Resfriado;Costela Do Dianteiro Assado De Tiras Uruguaia Wagyu Tacuarembó
4;BRF - Perdigăo;Bovinos;7899638367806;;Resfriado;Coxăo Duro Perdigăo Montana
4;BRF - Perdigăo;Bovinos;7899638367097;;Congelado;Costela Do Traseiro Minga Perdigăo Montana - 5,5 a 8,5kg
4;BRF - Perdigăo;Aves;7899638366632;;Resfriado;Cupim Resfriado Perdigăo na Brasa - 0,8 a 2kg
4;BRF - Perdigăo;Aves;7899638366243;;Congelado;Cupim Perdigăo na Brasa - 2 a 4,5kg
4;BRF - Perdigăo;Aves;7899638366236;;Congelado;Cupim Congelado Perdigăo na Brasa - 0,8 a 2kg
4;BRF - Perdigăo;Aves;7899638366601;;Resfriado;Coxăo Duro Com Gordura Perdigăo na Brasa
3;BRF - Sadia;Outros;7891515559625;;Congelado;Filé Mignon Suíno em Tiras Sadia 400g - Caixa c/12
3;BRF - Sadia;Suínos;7891515559632;;Congelado;Lombo Suíno em Cubos Sadia 400g - Caixa c/12
3;BRF - Sadia;Suínos;7891515558819;;Congelado;Copa Lombo Suíno em Cubos Sadia 400g - Caixa c/12
3;BRF - Sadia;Suínos;7891515588243;;Congelado;Bisteca Suína Sadia 800g - Caixa c/10
3;BRF - Sadia;Suínos;7891515558628;;Congelado;Lombo Suino Fatiado Sadia 800g -Caixa c/10
3;BRF - Sadia;Suínos;7891515558611;;Seco;Copa Lombo Suíno Fatiado Sadia 800g - Caixa c/10
3;BRF - Sadia;Suínos;7891515558635;;Congelado;File Mignon Suino Fatiado Sadia 800g -Caixa c/10
3;BRF - Sadia;Outros;7891515587796;;Congelado;Camarăo Vannamei 80/100pcs Sadia 400g -Caixa c/25
3;BRF - Sadia;Outros;7891515587789;;Congelado;Camarăo Vannamei 30/50 pcs Sadia 400g -Caixa c/25
3;BRF - Sadia;Outros;7891515587772;;Congelado;Filé de Tilapia Sadia 400g -Caixa c/30
3;BRF - Sadia;Outros;7891515587765;;Congelado;Filé de Pescadinha Sadia 400g -Caixa c/25
4;BRF - Perdigăo;Suínos;7891515586430;;Congelado;Copa Lombo Suína Congelada Temperada Chimichurri Perdigăo Na Brasa - Caixa c/ 16
4;BRF - Perdigăo;Suínos;7891515586416;;Congelado;Panceta Suína Congelada Temperada Toque de Limăo Perdigăo Na Brasa - Caixa c/ 16
5;BRF - Qualy;Margarinas;7891515586348;;Seco;Margarina 100% Vegetal Qualy 250g -Caixa c/24
4;BRF - Perdigăo;Suínos;7891515585761;;Congelado;Linguiça Toscana Fininha Chimichurri Perdigăo Na Brasa 400g -Caixa c/20
4;BRF - Perdigăo;Suínos;7891515585747;;Congelado;Linguiça Toscana Fininha Perdigăo na Brasa 400g -Caixa c/20
4;BRF - Perdigăo;Suínos;7891515585778;;Congelado;Linguiça Calabresa Fininha Apimentada Perdigăo Na Brasa 400g -Caixa c/20
4;BRF - Perdigăo;Aves;7891515585716;;Congelado;Arroz de Forno c/ Frango e Creme de Milho 600g -Caixa c/6
3;BRF - Sadia;Aves;7891515585617;;Congelado;Meio Da Asa Fgo 31G/Up Cong IQF 6Kg Sd
4;BRF - Perdigăo;Suínos;7891515585419;;Congelado;Polenta com Ragu de Calabresa Nosso Menu Perdigăo 600g -Caixa c/6
4;BRF - Perdigăo;Aves;7891515580674;;Congelado;Hamburguer Bovino de Costela Na Brasa Perdigăo 300g -Caixa c/12
4;BRF - Perdigăo;Aves;7891515580667;;Congelado;Hamburguer bovino de Picanha Na Brasa Perdigăo 300g -Caixa c/12
3;BRF - Sadia;Bovinos;7891515581336;;Congelado;Almondega Bovina ao Sugo Congelada Sadia 500g -Caixa c/6
3;BRF - Sadia;Lanches;7891515580827;;Congelado;Veg Nuggets Sadia Veg&Tal 275g -Caixa c/15
3;BRF - Sadia;Suínos;7891515577742;;Congelado;Torta de Carne Suína com Barbecue Sadia 500g -Caixa c/6
3;BRF - Sadia;Outros;7891515576929;;Congelado;Torta de Abobrinha e Cream Cheese com Massa de Iogurte Sadia Veg&Tal 500g -Caixa c/6
3;BRF - Sadia;Outros;7891515577513;;Seco;Lanche Vegetal sabor cheddar Sadia 145g -Caixa c/18
5;BRF - Qualy;Margarinas;7891515520656;;Seco;Margarina Qualy Vita sem Sal 500g -Caixa c/12
3;BRF - Sadia;Aves;7891515575946;;Seco;Coxa C/Op Fgo Temp Bio As Fac Sd
3;BRF - Sadia;Aves;7891515575922;;Seco;Sobrecoxa Frango Temperado Sadia Bio Assa Fácil 800g -Caixa c/8
3;BRF - Sadia;Bovinos;7891515575915;;Seco;Kibe Bovino Sadia 0,9kg -Caixa c/4
3;BRF - Sadia;Aves;7891515575724;;Congelado;Filé de Peito de Chester para Churrasco Caixa 10,2 kg
4;BRF - Perdigăo;Aves;7891515575717;;Congelado;Coxa e Sobrecoxa Chester Na Brasa 1,5 kg a 2,0 kg
3;BRF - Sadia;Bovinos;7891515575533;;Seco;Almondega Bovina Sadia 0,9kg -Caixa c/4
5;BRF - Qualy;Margarinas;7891515520632;;Seco;Margarina Qualy Vita com Sal 500g -Caixa c/12
4;BRF - Perdigăo;Aves;7891515742089;;Resfriado;Salsicha de Frango Perdigăo 500g -Caixa c/12
4;BRF - Perdigăo;Outros;7891515742065;;Resfriado;Salsicha Viena Perdigăo 500g -Caixa c/12
4;BRF - Perdigăo;Outros;7891515742034;;Resfriado;Salsicha Hot-Dog Perdigăo 500g -Caixa c/12
5;BRF - Qualy;Margarinas;7891515520625;;Seco;Margarina Qualy Vita com Sal 250g -Caixa c/24
3;BRF - Sadia;Aves;7891515574857;;Congelado;Peito de Frango Empanado Empanadíssimo Sadia 400g -Caixa c/10
7;BRF - Claybom;Margarinas;7891515574840;;Seco;Margarina Sabor Manteiga Resfriada Claybom 1Kg
3;BRF - Sadia;Aves;7891515574383;;Congelado;Filé de Peito de Frango em Bifes Sadia 1Kg -Caixa c/12
3;BRF - Sadia;Aves;7891515574550;;Congelado;Filé de Peito de Frango em Bifes Sadia 800g -Caixa c/12
8;BRF - Becel;Margarinas;7891515562236;;Seco;Margarina com Fitoesteróis Pro Activ Becel 250g - Caixa c/12
8;BRF - Becel;Margarinas;7891515555269;;Seco;Margarina Becel Original Sem Sal 250G -Caixa c/24
3;BRF - Sadia;Outros;7891515574697;;Congelado;Paleta Suína sem Osso Sadia 18kg -Caixa c/1
3;BRF - Sadia;Suínos;7891515574680;;Congelado;Pernil Suíno sem Osso Sadia 18kg -Caixa c/1
3;BRF - Sadia;Outros;7891515574703;;Congelado;Filé Mignon Suíno Sadia 18kg -Caixa c/11
8;BRF - Becel;Margarinas;7891515555351;;Seco;Margarina Becel Amanteigada Com Sal 250g -Caixa c/24
8;BRF - Becel;Margarinas;7891515555245;;Seco;Margarina Becel Original Com Sal 250g -Caixa c/24
8;BRF - Becel;Margarinas;7891515555344;;Seco;Margarina Amanteigada C/ Sal Becel 500g -Caixa c/12
8;BRF - Becel;Margarinas;7891515555252;;Seco;Margarina Ômega 6 Original s/ Sal Becel Pote 500g -Caixa c/12
8;BRF - Becel;Margarinas;7891515555337;;Seco;Margarina Ômega 6 Original c/ Sal Becel 500g-Caixa c/12
3;BRF - Sadia;Aves;7891515572518;;Congelado;Peito de Frango Empanadíssimo Temperado Sadia 400g -Caixa c/10
3;BRF - Sadia;Aves;7891515563516;;Congelado;Filé de Peito de Frango Sadia Bandeja 1kg (cortes menores) - Caixa c/12
3;BRF - Sadia;Aves;7891515563509;;Congelado;Coxa de Frango c/ Osso Sadia Bandeja 1kg -Caixa c/12
3;BRF - Sadia;Aves;7891515563240;;Congelado;Sobrecoxa de Frango c/ Osso e Pele Sadia Bandeja 1kg -Caixa c/12
3;BRF - Sadia;Aves;7891515562854;;Congelado;Coxinhas da Asa Empanada Apimentada Sadia 400G -Caixa c/14
3;BRF - Sadia;Aves;7891515433703;;Resfriado;Peito Peru Defumado Fatiado Soltíssimo Sadia 200G -Caixa c/21
5;BRF - Qualy;Margarinas;7891515561314;;Resfriado;Păo De Queijo Presunto Qualy 375G -Caixa c/20
3;BRF - Sadia;Outros;7891515432652;;Resfriado;Presunto Cozido Fatiado Soltíssimo Sadia 200G -Caixa c/21
5;BRF - Qualy;Margarinas;7891515557461;;Resfriado;Requeijao Qualy Light 200G -Caixa c/24
5;BRF - Qualy;Margarinas;7891515557317;;Resfriado;Manteiga Qualy Pote Com Sal 200G -Caixa c/12
5;BRF - Qualy;Margarinas;7891515557454;;Resfriado;Requeijao Qualy Tradicional 200G -Caixa c/24
5;BRF - Qualy;Margarinas;7891515557447;;Resfriado;Manteiga Qualy Tablete Sem Sal 200G -Caixa c/30
5;BRF - Qualy;Margarinas;7891515557430;;Resfriado;Manteiga Qualy Tablete Com Sal 200G -Caixa c/30
5;BRF - Qualy;Margarinas;7891515557423;;Resfriado;Manteiga Qualy Pote Com Sal 500G -Caixa c/6
3;BRF - Sadia;Outros;7891515556334;;Congelado;Hot Pocket Sadia X-Burguer Maionese Grill 145g -Caixa c/18
3;BRF - Sadia;Outros;7891515556327;;Congelado;Hot Pocket Sadia X-Cheddar Cremoso 145g -Caixa c/18
3;BRF - Sadia;Outros;7891515556341;;Congelado;Hot Pocket Sadia X-Burguer Barbecue 145g -Caixa c/18
3;BRF - Sadia;Outros;7891515556914;;Resfriado;Banha Sadia 500g -Caixa c/18
4;BRF - Perdigăo;Aves;7891515555511;;Congelado;Filé Mignon Suíno c/ Laranja, Limăo, Mel Perdigăo Na Brasa Caixa 12kg
3;BRF - Sadia;Aves;7891515554910;;Congelado;Supreme Fácil Sadia 2,7 kg a 3,7 kg
3;BRF - Sadia;Aves;7891515554224;;Congelado;Hambúrguer de Carne de Frango e Bovina Sadia 56g -Caixa c/36
3;BRF - Sadia;Aves;7891515554323;;Congelado;Filezinho Peito Frango Sadia Orgânico 600g -Caixa c/16
3;BRF - Sadia;Aves;7891515554361;;Congelado;Meio da Asa de Frango Sadia Orgânico 600g -Caixa c/16
3;BRF - Sadia;Aves;7891515554354;;Congelado;Coxinha da Asa de Frango Sadia Orgânico 600g -Caixa c/16
3;BRF - Sadia;Aves;7891515554347;;Congelado;Sobrecoxa de Frango Sadia Orgânico 600g -Caixa c/16
3;BRF - Sadia;Aves;7891515554330;;Congelado;Coxa de Frango Sadia Orgânico 600g -Caixa c/16
3;BRF - Sadia;Aves;7891515554385;;Congelado;Fígado de Frango Sadia Orgânico 600g -Caixa c/16
3;BRF - Sadia;Aves;7891515554378;;Congelado;Coraçăo de Frango Sadia Orgânico 600g -Caixa c/16
3;BRF - Sadia;Aves;7891515553876;;Congelado;Filé de Peito de Frango Sadia Orgânico 600g -Caixa c/16
3;BRF - Sadia;Aves;7891515553869;;Congelado;Frango com Miúdos Sadia Orgânico Caixa 16kg
3;BRF - Sadia;Aves;7891515554316;;Congelado;Hambúrguer de Frango Sadia 56g -Caixa c/36
4;BRF - Perdigăo;Suínos;7891515553227;;Resfriado;Rabo Suíno Salgado Perdigăo Caixa 13kg
4;BRF - Perdigăo;Aves;7891515687113;;Resfriado;Frango Cozido Defumado Perdigăo 1,1kg a 1,3kg
3;BRF - Sadia;Outros;7891515551568;;Congelado;Mix de Vegetais Congelados Sadia Veg&Tal 1,05kg -Caixa c/10
3;BRF - Sadia;Outros;7891515551551;;Congelado;Mix de Vegetais Congelados Sadia Veg&Tal 300g -Caixa c/12
3;BRF - Sadia;Outros;7891515551377;;Congelado;Couve-Flor Congelada Sadia Veg&Tal 300g -Caixa c/12
3;BRF - Sadia;Outros;7891515551360;;Congelado;Couve-Flor Congelada Sadia Veg&Tal 1kg -Caixa c/10
3;BRF - Sadia;Outros;7891515551353;;Congelado;Ervilha Congelado Sadia Veg&Tal 1Kg -Caixa c/10
3;BRF - Sadia;Outros;7891515551346;;Congelado;Ervilha Congelada Sadia Veg&Tal 300g -Caixa c/20
3;BRF - Sadia;Suínos;7891515550905;;Congelado;T-Bone Suíno Food Service Sadia Speciale 2Kg -Caixa c/3
3;BRF - Sadia;Suínos;7891515550899;;Congelado;Prime Rib Suíno Food Service Sadia Speciale 1,6Kg -Caixa c/3
3;BRF - Sadia;Outros;7891515551230;;Congelado;Brócolis Congelado Sadia Veg&Tal 1kg -Caixa c/10
3;BRF - Sadia;Outros;7891515551223;;Congelado;Brócolis Congelado Sadia Veg&Tal 300g -Caixa c/12
3;BRF - Sadia;Suínos;7893000516830;;Congelado;Lombo Suíno Sem Osso Congelado Sadia Food Service 10Kg
9;BRF - Sofiteli;Margarinas;7891515550097;;Resfriado;Margarina com Sal 75% de Lidípio Sofiteli Balde 3kg- Caixa com 6
3;BRF - Sadia;Suínos;7891515549527;;Resfriado;Snack Salamitos Sweet Chilli Sadia 36g -Caixa c/50
7;BRF - Claybom;Margarinas;7891515548889;;Resfriado;Margarina Sabor Manteiga com Sal Claybom Pote 500g -Caixa c/12
7;BRF - Claybom;Margarinas;7891515548872;;Resfriado;Margarina Sabor Manteiga com Sal Claybom Pote 250g -Caixa c/24
3;BRF - Sadia;Outros;7891515547554;;Congelado;Batata Pré-Frita Palito Tradicional Congelada Sadia 2kg -Caixa c/5
3;BRF - Sadia;Aves;7891515547974;;Congelado;Peito de Frango Cozido Desfiado Sadia Na Receita 400g -Caixa c/12
3;BRF - Sadia;Outros;7891515547240;;Congelado;Batata Pré-Frita Canoa Congelada Sadia 1,05kg -Caixa c/10
3;BRF - Sadia;Outros;7891515547226;;Congelado;Batata Pré-Frita Rústica Congelada Sadia 1,05kg -Caixa c/10
4;BRF - Perdigăo;Suínos;7891515546847;;Resfriado;Bacon Defumado Fatiado Perdigăo 250g -Caixa c/15
3;BRF - Sadia;Aves;7891515546212;;Congelado;Coxinha da Asa Empanada Sadia 700g -Caixa c/8
3;BRF - Sadia;Outros;7891515546519;;Congelado;Batata Pré-Frita Palito Congelada Sadia 400g -Caixa c/25
3;BRF - Sadia;Outros;7891515546335;;Congelado;Batata Pré-Frita Palito Congelada Sadia 1,05kg -Caixa c/10
3;BRF - Sadia;Aves;7891515545543;;Congelado;Empanado de Frango em Iscas Sadia Food Service 1kg -Caixa c/3
4;BRF - Perdigăo;Suínos;7891515545536;;Congelado;Linguiça de Pernil Suíno Perdigăo 700g -Caixa c/18
3;BRF - Sadia;Outros;7891515545420;;Congelado;Torta Espinafre e Ricota c/ Massa Iogurte Sadia Veg&Tal 500g -Caixa c/6
3;BRF - Sadia;Outros;7891515545413;;Congelado;Torta Brócolis e Requeijăo c/ Massa Iogurte Sadia Veg&Tal 500g -Caixa c/6
4;BRF - Perdigăo;Outros;7891515544041;;Congelado;Mini Chicken Tradicional Perdigăo 1kg -Caixa c/8
4;BRF - Perdigăo;Suínos;7891515544126;;Congelado;Linguiça de Pernil Suíno Perdigăo 5kg -Caixa c/4
4;BRF - Perdigăo;Aves;7891515666217;;Congelado;Linguiça de Frango Perdigăo Na Brasa 5kg -Caixa c/4
4;BRF - Perdigăo;Suínos;7891515662929;;Congelado;Linguiça de Pernil Suíno Perdigăo Na Brasa 5kg -Caixa c/4
4;BRF - Perdigăo;Outros;7891515539177;;Resfriado;Mortadela Fatiada Perdigăo Ouro com Ervas Finas 200g -Caixa c/20
3;BRF - Sadia;Bovinos;7891515539122;;Congelado;Costela Tira Suína CONG IWP Sadia PVAR
4;BRF - Perdigăo;Aves;7891515538828;;Seco;Coxa e Sobrecoxa de Frango Desossada Sem Pele Perdigăo 1Kg -Caixa c/16
4;BRF - Perdigăo;Outros;7891515539153;;Resfriado;Mortadela Fatiada Perdigăo Ouro com Azeitona 200g -Caixa c/20
5;BRF - Qualy;Margarinas;7891515537531;;Resfriado;Margarina Qualy Cremosa com Sal 250g - Potes Colecionáveis -Caixa c/24
3;BRF - Sadia;Bovinos;7893000134638;;Congelado;Almondega Bovina Sadia 500g -Caixa c/12
3;BRF - Sadia;Outros;7893000122116;;Congelado;Kibe Sadia 500g -Caixa c/12
3;BRF - Sadia;Aves;7893000486744;;Congelado;Hamburguer De Frango Sadia 56 G -Caixa c/12
4;BRF - Perdigăo;Aves;7891515323677;;Congelado;Hamburguer Frango Perdigăo 672g -Caixa c/12
4;BRF - Perdigăo;Aves;7891515883034;;Congelado;Hamburguer Frango/Bovino Defumado Perdigăo 672G -Caixa c/12
4;BRF - Perdigăo;Aves;7891515879716;;Congelado;Hamburguer de Frango/Bovino Suave Pacote 90G Caixa 3,24Kg
4;BRF - Perdigăo;Aves;7891515323691;;Congelado;Hamburguer de carne Bovina e Aves Perdigăo 672g -Caixa c/12
3;BRF - Sadia;Bovinos;7893000525238;;Congelado;Hamburger Bovino Sadia 90g -Caixa c/60
3;BRF - Sadia;Bovinos;7893000387096;;Congelado;Hamburger Bovino Sadia - 12 Un. 672g -Caixa c/12
3;BRF - Sadia;Aves;7893000486317;;Congelado;Hambúrguer de Carne de Frango e Bovina Churrasco Sadia Churras Burger 672g
4;BRF - Perdigăo;Aves;7891515536015;;Congelado;Fusilli com Tiras de Frango Perdigăo Meu Menu 600g -Caixa c/6
4;BRF - Perdigăo;Outros;7891515535209;;Congelado;Penne com Mini Almôndegas Perdigăo Meu Menu 600g -Caixa c/6
3;BRF - Sadia;Aves;7891515535568;;Congelado;Coxinha da Asa Empanada Sadia 2kg -Caixa c/3
3;BRF - Sadia;Suínos;7891515534714;;Resfriado;Salame Italiano Fatiado c/ Borda Pimenta Sadia Speciale 100g -Caixa c/40
3;BRF - Sadia;Aves;7891515534110;;Congelado;Coxinha da Asa Empanada Sadia 400g -Caixa c/14
4;BRF - Perdigăo;Suínos;7891515533014;;Congelado;Pizza Calabresa Moída Perdigăo 460g
4;BRF - Perdigăo;Lanches;7891515532925;;Congelado;Pizza Napolitana Perdigăo 460g
4;BRF - Perdigăo;Lanches;7891515532918;;Congelado;Pizza Brasileira Perdigăo 460g
4;BRF - Perdigăo;Suínos;7891515631024;;Resfriado;Linguiça Calabresa Enroladinha Perdigăo 500g -Caixa c/12
3;BRF - Sadia;Aves;7891515532628;;Congelado;Hambúrguer de Frango Empanado Caixa Sadia 360g -Caixa c/15
3;BRF - Sadia;Aves;7891515532352;;Congelado;Frango sem Miúdos Sadia 1,4kg -Caixa c/10
3;BRF - Sadia;Aves;7891515532345;;Congelado;Frango sem Miúdos Sadia 1,3Kg -Caixa c/10
3;BRF - Sadia;Aves;7891515532338;;Congelado;Frango sem Miúdos Sadia 1,1Kg -Caixa c/10
3;BRF - Sadia;Aves;7891515532321;;Congelado;Frango sem Miúdos Sadia Caixa Caixa 10kg
3;BRF - Sadia;Aves;7891515532314;;Congelado;Frango sem Miúdos Sadia 950g -Caixa c/10
4;BRF - Perdigăo;Aves;7891515614072;;Congelado;Filé de Peito de Frango sem Pele sem Osso Perdigăo 1kg -Caixa c/12
4;BRF - Perdigăo;Aves;7891515614065;;Congelado;Filezinho Sassami de Frango Perdigăo 1kg -Caixa c/12
4;BRF - Perdigăo;Aves;7891515851941;;Congelado;Peru Perdigăo 4 kg a 4,99 kg
4;BRF - Perdigăo;Aves;7891515989408;;Congelado;Hambúrguer de Carne de Frango e Bovina Perdigăo 56g -Caixa c/36
4;BRF - Perdigăo;Aves;7891515989415;;Congelado;Hambúrguer de Frango Perdigăo Caixa 2kg
3;BRF - Sadia;Suínos;7891515531676;;Resfriado;Salame Pepperoni Fatiado Sadia 100g -Caixa c/30
4;BRF - Perdigăo;Aves;7891515531331;;Congelado;Fígado de Frango Perdigăo 1kg -Caixa c/16
3;BRF - Sadia;Aves;7891515531164;;Congelado;Filezinho Sassami de Frango Temperado Sadia Marinados 1kg -Caixa c/12
3;BRF - Sadia;Aves;7891515531157;;Congelado;Filé de Peito de Frango Sadia Marinado 1kg -Caixa c/12
4;BRF - Perdigăo;Outros;7891515528836;;Resfriado;Mortadela Tradicional Perdigăo 4,8kg -Caixa c/2
4;BRF - Perdigăo;Outros;7891515518417;;Resfriado;Linguiça Mista Defumada Fininha Perdigăo 1kg -Caixa c/13
3;BRF - Sadia;Suínos;7891515516314;;Congelado;Bisteca Suína Sadia Caixa 10kg
4;BRF - Perdigăo;Outros;7891515936334;;Congelado;Penne Ao Sugo E Manjericao Congelado Perdigăo 350g -Caixa c/12
4;BRF - Perdigăo;Lanches;7891515936341;;Congelado;Fetuccini Com Molho Branco Congelado Perdigăo 350g -Caixa c/12
4;BRF - Perdigăo;Outros;7891515936327;;Congelado;Penne Com Molho Parisiense Congelado Perdigăo 350g -Caixa c/12
4;BRF - Perdigăo;Lanches;7891515493417;;Congelado;Păo de Queijo Coquetel Food Service Perdigăo Tá na Măo! 900g -Caixa c/10
3;BRF - Sadia;Aves;7891515492229;;Congelado;Strogonoff Frango com Arroz e Batata Sadia 350g -Caixa c/6
3;BRF - Sadia;Aves;7893000012547;;Congelado;Torta Caipira de Frango Sadia 500g -Caixa c/6
4;BRF - Perdigăo;Aves;7891515488901;;Congelado;Steak de Frango Empanado Perdigăo 700g -Caixa c/4
3;BRF - Sadia;Outros;7893000012578;;Congelado;Torta Palmito e Requeijăo com Massa de Iogurte Sadia 500g -Caixa c/6
3;BRF - Sadia;Aves;7893000012509;;Congelado;Torta De Frango Com Requeijao 500G
3;BRF - Sadia;Aves;7891515443238;;Congelado;Frango Assado com Arroz e Batata Sadia 350g -Caixa c/6
4;BRF - Perdigăo;Outros;7891515442965;;Congelado;Feijoada Pronta Perdigăo 0,8Kg -Caixa c/4
3;BRF - Sadia;Aves;7891515443221;;Congelado;Frango ŕ Parmegiana com Arroz e Batata Palha Sadia 350g -Caixa c/6
3;BRF - Sadia;Aves;7893000052895;;Congelado;Escondidinho de Frango Sadia 600g -Caixa c/6
3;BRF - Sadia;Outros;7893000052888;;Congelado;Escondidinho de Carne Moída Sadia 600g -Caixa c/6
3;BRF - Sadia;Outros;7893000069350;;Resfriado;Linguiça Mista Defumada Fininha Sadia 240g -Caixa c/21
3;BRF - Sadia;Bovinos;7899638341189;;Resfriado;Ovino Alcatra Completa Cg Nirea
3;BRF - Sadia;Suínos;7899638342957;;Resfriado;Bife Angosto De Cordeiro (Lombo) S/O Cg Nirea
5;BRF - Qualy;Margarinas;7891515662165;;Seco;Margarina Qualy Facil Refoga C/Sal 500G
5;BRF - Qualy;Margarinas;7891515662141;;Seco;Margarina Qualy Facil Trad C/Sal 500G
4;BRF - Perdigăo;Outros;7899638369015;;Seco;Jerked Beef Traseiro Perdigăo Montana - 5kg
3;BRF - Sadia;Bovinos;7899638352406;;Congelado;Contra - Filé Wagyu Tacuarembó
3;BRF - Sadia;Bovinos;7899638354677;;Seco;Coraçăo Alcatra Steak Sadia Bassi
3;BRF - Sadia;Bovinos;7899638352291;;Congelado;Contra - Filé Steak Sadia Bassi - Bife 200 a 250g
3;BRF - Sadia;Bovinos;7899638352307;;Congelado;Contra - Filé Tira Sadia Bassi
3;BRF - Sadia;Bovinos;7899638351966;;Congelado;Contra - Filé Chorizo Sem Cordăo Sem Aba Sadia Bassi
3;BRF - Sadia;Bovinos;7899638365079;;Congelado;Coraçăo Da Alcatra Steak Sadia Bassi
3;BRF - Sadia;Bovinos;7899638365758;;Resfriado;Contra - Filé Sadia Bassi Angus - 4,1kg
4;BRF - Perdigăo;Aves;7899638366625;;Resfriado;Coxăo Mole Com Gordura Perdigăo na Brasa
3;BRF - Sadia;Bovinos;7899638366076;;Congelado;Coxăo Mole Congelado Sadia Bassi Angus
3;BRF - Sadia;Bovinos;7899638365581;;Congelado;Contra - Filé Maturado Sadia Bassi Angus - 4,1kg
4;BRF - Perdigăo;Aves;7899638366779;;Congelado;Contra - Filé Bife Perdigăo na Brasa - 80 a 100g
3;BRF - Sadia;Bovinos;7899638365703;;Resfriado;Coxăo Mole Resfriado Sadia Bassi Angus
4;BRF - Perdigăo;Bovinos;7899638367639;;Resfriado;Coxăo Mole Resfriado Perdigăo Montana
4;BRF - Perdigăo;Aves;7899638366861;;Congelado;Contra - Filé Iscas Perdigăo na Brasa - 1,4 a 1,6kg
4;BRF - Perdigăo;Aves;7899638366878;;Congelado;Coraçăo Da Alcatra Iscas Perdigăo na Brasa - 1,3 a 1,4kg
4;BRF - Perdigăo;Bovinos;7899638367752;;Resfriado;Pera Do Coxăo Mole Perdigăo Montana
4;BRF - Perdigăo;Bovinos;7899638367608;;Resfriado;Capa Do Coxăo Mole Resfriado Perdigăo Montana - 2,2kg
4;BRF - Perdigăo;Bovinos;7899638367127;;Congelado;Coxăo Mole Congelado Perdigăo Montana
4;BRF - Perdigăo;Bovinos;7899638367004;;Congelado;Capa Do Coxăo Mole Congelado Perdigăo Montana
3;BRF - Sadia;Bovinos;7899638364874;;Resfriado;Contra - Filé Bife De Chorizo Resfriado Sadia Bassi - 0,8 a 1,4kg
4;BRF - Perdigăo;Bovinos;7899638367622;;Resfriado;Coxăo Mole Perdigăo Montana
4;BRF - Perdigăo;Aves;7899638366618;;Resfriado;Coxăo Mole Perdigăo na Brasa
3;BRF - Sadia;Bovinos;7899638364973;;Congelado;Contra - Filé Bife De Chorizo Congelado Sadia Bassi
3;BRF - Sadia;Bovinos;7899638340083;;Congelado;Acém Short Ribs Wagyu Uruguaia Tacuarembó - 9,4kg
4;BRF - Perdigăo;Aves;7899638366786;;Resfriado;Acém E Pescoço Perdigăo na Brasa
4;BRF - Perdigăo;Aves;7899638366496;;Resfriado;Acém Perdigăo na Brasa
4;BRF - Perdigăo;Bovinos;7899638367547;;Resfriado;Bananinha Do Contra - Filé Resfriado Perdigăo Montana
3;BRF - Sadia;Bovinos;7899638364966;;Congelado;Acém Short Rib Sadia Bassi
3;BRF - Sadia;Bovinos;7899638365901;;Congelado;Acém Short Rib Sadia Bassi Angus
3;BRF - Sadia;Bovinos;7899638365529;;Congelado;Acém Short Rib Maturado Sadia Bassi Angus - 4 a 6,5kg
4;BRF - Perdigăo;Bovinos;7899638366984;;Congelado;Bananinha Do Contra - Filé Congelado Perdigăo Montana
4;BRF - Perdigăo;Bovinos;7899638367523;;Resfriado;Acém Perdigăo Montana
3;BRF - Sadia;Outros;7899638349147;;Congelado;Fraldao Wagyu Importado Tacuarembó
4;BRF - Perdigăo;Outros;7899638367370;;Congelado;Paleta Congelado Perdigăo Montana
3;BRF - Sadia;Bovinos;7899638370189;;Congelado;Maminha Da Alcatra Sadia Bassi Stars
3;BRF - Sadia;Outros;7899638370158;;Congelado;Fralda Sadia Bassi Stars - 1,4kg
3;BRF - Sadia;Aves;7899638370202;;Congelado;Peito Sadia Bassi Stars
3;BRF - Sadia;Outros;7899638370103;;Congelado;Contra - Filé Sadia Bassi Stars
3;BRF - Sadia;Bovinos;7899638370141;;Congelado;Filé Costela Sadia Bassi Stars - 2,5kg
3;BRF - Sadia;Outros;7899638344630;;Congelado;Recorte Traseiro Palatare - 140 a 260g
4;BRF - Perdigăo;Outros;7899638367257;;Congelado;Bife Do Vazio Perdigăo Montana
3;BRF - Sadia;Outros;5602772403024;;Congelado;Bolinhos Com Bacalhau Soguima - 360g
3;BRF - Sadia;Bovinos;7899638349598;;Congelado;Picanha B Importado Nirea
3;BRF - Sadia;Bovinos;7899638341103;;Congelado;Picanha Importado P La Morocha
3;BRF - Sadia;Bovinos;7899638344883;;Congelado;Picanha Importado Super San Jacinto - 1 a 1,8kg
3;BRF - Sadia;Bovinos;7899638345576;;Congelado;Picanha Uruguaia Importada L Tacuarembó
