marca-id;marca-descr;produto-classe;produto-ean;produto-dun;produto-conservacao;produto-descr
1;Lar;Batatas;7896419730729;17896419730726;Congelado;Batata Palito Airfryer
1;Lar;Pescados;7896419731917;17896419731914;Congelado;Filé de Tilápia
1;Lar;Pescados;7896419731801;17896419731808;Congelado;Filé de Tilápia
1;Lar;Pescados;7896419731900;17896419731907;Congelado;Filé de Tilápia
1;Lar;Quentes;7896419720270;17896419720277;Congelado;Anéis de Cebola
1;Lar;Quentes;7896419720287;17896419720284;Congelado;Anéis de Cebola
1;Lar;Batatas;7896419730705;17896419730702;Congelado;Batata Palito
1;Lar;Batatas;7896419730347;17896419730344;Congelado;Batata Palito
1;Lar;Quentes;7896419724384;17896419724381;Congelado;Polenta Palito
1;Lar;Quentes;7896419712770;17896419712777;Congelado;Polenta Palito
1;Lar;Bandejas Congeladas;7896419728887;17896419728884;Congelado;Coraçăo Bandeja • Congelada
1;Lar;Bandejas Congeladas;7896419727286;17896419727283;Congelado;Coraçăo Bandeja • Congelada
1;Lar;Bandejas Congeladas;7896419728900;17896419728907;Congelado;Coxas e Sobrecoxas • Bandeja Congelada 1kg
1;Lar;Bandejas Congeladas;7896419728894;17896419728891;Congelado;Coxinhas das Asas Bandeja • Congelada
1;Lar;Bandejas Congeladas;7896419727309;17896419727306;Congelado;Coxinhas das Asas Bandeja • Congelada
1;Lar;Bandejas Congeladas;7896419728870;17896419728877;Congelado;Filé de Peito Bandeja • Congelada
1;Lar;Bandejas Congeladas;7896419727316;17896419727313;Congelado;Filé de Peito Bandeja • Congelada
1;Lar;Bandejas Congeladas;7896419728917;17896419728914;Congelado;Filezinho Sassami Bandeja • Congelada
1;Lar;Bandejas Congeladas;7896419727323;17896419727320;Congelado;Filezinho Sassami Bandeja • Congelada
1;Lar;Bandejas Congeladas;7896419727279;17896419727276;Congelado;Moela Bandeja • Congelada
1;Lar;Bandejas Resfriadas;7896419728078;17896419728075;Resfriado;Coraçăo Bandeja • Resfriado
1;Lar;Bandejas Resfriadas;7896419728047;17896419728044;Resfriado;Coxinhas das Asas Bandeja • Resfriada
1;Lar;Bandejas Resfriadas;7896419728023;17896419728020;Resfriado;Filé de Peito Bandeja • Resfriado
1;Lar;Bandejas Resfriadas;7896419728085;17896419728082;Resfriado;Filezinho Sassami Bandeja • Resfriada
1;Lar;Bandejas Resfriadas;7896419727996;17896419727993;Resfriado;Meio das Asas Bandeja • Resfriada
1;Lar;Bandejas Resfriadas;7896419728030;17896419728037;Resfriado;Moela Bandeja • Resfriada
1;Lar;Bandejas Resfriadas;7896419728009;17896419728006;Resfriado;Sobrecoxas Bandeja • Resfriada
1;Lar;Cozidos;7896419731177;17896419731174;Congelado;Frango Desfiado
1;Lar;Cozidos;7896419728757;27896419728751;Congelado;Meio Peito Cozido em Cubos Linha Minuto 300g
1;Lar;Cozidos;7896419728740;27896419728744;Congelado;Meio Peito Cozido em Tiras Linha Minuto 300g
1;Lar;Cozidos;7896419728849;17896419728846;Congelado;Coxinha da Asa Assado Linha Minuto 300g
1;Lar;Cozidos;7896419728818;17896419728815;Congelado;Meio da asa assada Linha Minuto 300g
1;Lar;Cozidos;7896419728825;17896419728822;Congelado;Filezinho Sassami Assado Linha Minuto 300g
1;Lar;Empanados;7896419714071;17896419714078;Congelado;Empanitos Empanado
1;Lar;Empanados;7896419725336;17896419725333;Congelado;Empanitos Empanado
1;Lar;Empanados;7896419725480;17896419725487;Congelado;Filé ŕ milanesa
1;Lar;Empanados;7896419717560;17896419717567;Congelado;Filé de Coxas e Sobrecoxas Empanadas
1;Lar;Empanados;7896419725329;17896419725326;Congelado;Filé de Coxas e Sobrecoxas Empanadas
1;Lar;Empanados;7896419715566;17896419715563;Congelado;Filezinho Sassami Empanado
1;Lar;Empanados;7896419716129;17896419716126;Congelado;Filezinho Sassami Empanado
1;Lar;Empanados;7896419730156;17896419730153;Congelado;Mini Hambúrguer Empanado de Frango
1;Lar;Empanados;7896419725459;17896419725456;Congelado;Iscas Empanadas
1;Lar;Empanados;7896419713852;17896419713859;Congelado;Steak Empanado
1;Lar;Empanados;7896419729143;17896419729140;Congelado;Hambúrguer Empanado de Frango
1;Lar;Envelopados Congelados;7896419721475;17896419721472;Congelado;Asas Envelopadas • Congeladas
1;Lar;Envelopados Congelados;7896419720799;17896419721168;Congelado;Coxinhas das Asas Envelopadas • Congeladas
1;Lar;Envelopados Congelados;7896419719977;17896419721175;Congelado;Coxas e Sobrecoxas Envelopadas • Congeladas
1;Lar;Envelopados Congelados;7896419721536;17896419721533;Congelado;Filé de Coxas Sobrecoxas Envelopadas • Congeladas
1;Lar;Envelopados Congelados;7896419720386;17896419721182;Congelado;Filé de Peito Envelopado • Congelado
1;Lar;Envelopados Congelados;7896419720447;17896419721205;Congelado;Filezinho Sassami Envelopado • Congelado
1;Lar;Envelopados Congelados;7896419720393;17896419720390;Congelado;Peito com Osso Envelopado • Congelado
1;Lar;Envelopados Congelados;7896419720997;17896419721212;Congelado;Sambiquira Envelopada • Congelada
1;Lar;Envelopados Congelados;7896419720676;17896419721267;Congelado;Sobrecoxas Envelopadas • Congeladas
1;Lar;Envelopados Resfriados;7896419720959;17896419720956;Resfriado;Coxas e Sobrecoxas Envelopadas • Resfriadas
1;Lar;Envelopados Resfriados;7896419723424;17896419723421;Resfriado;Sobrecoxas Envelopadas • Resfriadas
1;Lar;Envelopados Resfriados;7896419723400;17896419723407;Resfriado;Coxas e Sobrecoxas sem Osso Envelopadas Resfriadas
1;Lar;Envelopados Resfriados;7896419720973;17896419720970;Resfriado;Coxinhas das Asas Envelopadas • Resfriadas
1;Lar;Envelopados Resfriados;7896419720966;17896419720963;Resfriado;Filé de Peito Envelopado • Resfriado
1;Lar;Envelopados Resfriados;7896419720980;17896419720987;Resfriado;Peito com Osso Envelopado • Resfriado
1;Lar;IQF;7896419714224;17896419714221;Congelado;Coxas IQF
1;Lar;IQF;7896419727811;17896419727825;Congelado;Coxas IQF 700g
1;Lar;IQF;7896419713784;17896419713781;Congelado;Coxinhas das Asas IQF
1;Lar;IQF;7896419727774;17896419727771;Congelado;Coxinhas das Asas IQF 700g
1;Lar;IQF;7896419716273;17896419716270;Congelado;Filé de Coxas e Sobrecoxas sem Osso com Pele IQF
1;Lar;IQF;7896419727859;17896419727856;Congelado;Filé de Coxas e Sobrecoxas sem Osso com Pele IQF
1;Lar;IQF;7896419727835;17896419727832;Congelado;Frango a Passarinho IQF
1;Lar;IQF;7896419701637;17896419701634;Congelado;Frango a Passarinho IQF
1;Lar;IQF;7896419716280;17896419716287;Congelado;Filé de Peito IQF
1;Lar;IQF;7896419727804;17896419727801;Congelado;Filé de Peito IQF 700g
1;Lar;IQF;7896419714231;17896419714238;Congelado;Filezinho Sassami IQF
1;Lar;IQF;7896419727798;17896419727795;Congelado;Filezinho Sassami IQF 700g
1;Lar;IQF;7896419715047;17896419715044;Congelado;Sobrecoxas IQF
1;Lar;IQF;7896419727828;17896419727825;Congelado;Sobrecoxas IQF 700g
1;Lar;IQF;7896419715092;17896419715099;Congelado;Meio das Asas IQF
1;Lar;Linguiças;7896419728863;17896419728860;Congelado;Filé de Peito Moído
1;Lar;Linguiças;7896419722656;17896419722653;Congelado;Linguiça de Frango Fininha Congelada
1;Lar;Linguiças;7896419728108;17896419728105;Congelado;Linguiça de Frango Fininha Congelada
1;Lar;Linguiças;7896419728092;17896419728099;Resfriado;Linguiça de Frango Fininha Resfriada 700g
1;Lar;Linguiças;7896419722274;17896419722271;Congelado;Linguiça de Frango Grossa Congelada
1;Lar;Linguiças;7896419722663;17896419722660;Congelado;Linguiça de Frango Grossa Congelada
1;Lar;Linguiças;7896419727439;17896419727436;Congelado;Linguiça de Frango Petisco Congelada
1;Lar;Miúdos;7896419729211;17896419729218;Congelado;Fígado
1;Lar;Vegetais;7896419724612;17896419724619;Congelado;Brócolis Congelado
1;Lar;Vegetais;7896419724582;17896419724589;Congelado;Ervilhas Congeladas
1;Lar;Vegetais;7896419724599;17896419724596;Congelado;Ervilhas Congeladas
1;Lar;Vegetais;7896419724537;17896419724534;Congelado;Mix de Vegetais Congelado
1;Lar;Vegetais;7896419724483;17896419724480;Congelado;Seleta de Legumes Congeladas
1;Lar;Vegetais;7896419724490;17896419724497;Congelado;Seleta de Legumes Congeladas
1;Lar;Empanados;7896419714064;17896419714061;Congelado;Tirinhas Empanadas
1;Lar;Cozidos;7896419731160;7896419731167;Congelado;Frango Desfiado
1;Lar;IQF Temperados;7896419730194;17896419730191;Congelado;Coxinha da Asa Temperadas IQF
1;Lar;IQF Temperados;7896419730774;17896419730771;Congelado;Filé de Coxas e Sobrecoxas Temperada IQF
1;Lar;IQF Temperados;7896419730200;17896419730207;Congelado;Frango a Passarinho Temperado IQF
1;Lar;Linguiças;7896419728115;17896419728112;Congelado;Linguiça de Frango Grossa Congelada
1;Lar;Miúdos;7896419729198;178964195729195;Congelado;Coraçăo
1;Lar;Miúdos;7896419729204;17896419729201;Congelado;Moela
1;Lar;Temperados;7896419730224;17896419730221;Congelado;Frango Inteiro Temperado Congelado
1;Lar;Vegetais;7896419720010;17896419720017;Congelado;Brócolis Congelado
1;Lar;Vegetais;7896419720003;17896419720000;Congelado;Couve-Flor Congelado
1;Lar;Temperados;7896419730842;17896419720146;Congelado;Ave Natalina Temperada Recheada Congelada
1;Lar;Empanados;7896419725343;17896419725340;Congelado;Tirinhas Empanadas
1;Lar;Envelopados Congelados;7896419721116;17896419721113;Congelado;Coxas e Sobrecoxas com Porçăo Dorsal Envelopadas • Congeladas
1;Lar;Envelopados Congelados;7896419723233;17896419723230;Congelado;Coxas e Sobrecoxas sem osso sem pele Envelopadas • Congeladas
1;Lar;IQF Temperados;7896419730187;17896419730184;Congelado;Meio da Asas Temperadas IQF
1;Lar;IQF Temperados;7896419730767;17896419730764;Congelado;Sobrecoxa Temperada IQF
1;Lar;IQF Temperados;7896419730217;17896419730214;Congelado;Filezinho Sassami Temperado IQF
1;Lar;Temperados;7896419729181;17896419729188;Congelado;Coraçăo Temperado
1;Lar;Temperados;7896419728955;17896419728952;Congelado;Coxinhas das Asas Temperadas
1;Lar;Temperados;7896419728948;17896419728945;Congelado;Meio das Asas Temperadas
1;Lar;Temperados;7896419728931;17896419728938;Congelado;Frango a Passarinho Temperado
3;BRF - Sadia;Aves;7891515527617;;Congelado;Hambúrguer de Frango Empanado Sadia 900g -Caixa c/4
4;BRF - Perdigăo;Suínos;7891515526511;;Resfriado;Embutido de Pernil Cozido Perdigăo Food Service 3,4Kg -Caixa c/2
3;BRF - Sadia;Suínos;7891515525729;;Resfriado;Linguiça Paio Defumada Sadia 370g -Caixa c/24
3;BRF - Sadia;Suínos;7891515524630;;Resfriado;Linguiça Tipo Portuguesa Defumada Sadia 400g -Caixa c/18
3;BRF - Sadia;Aves;7891515522384;;Congelado;Peito de Frango Cozido em Tiras Sadia na Receita 400g -Caixa c/12
3;BRF - Sadia;Aves;7891515522377;;Congelado;Peito de Frango Cozido em Cubos Sadia na Receita 400g -Caixa c/12
3;BRF - Sadia;Aves;7891515522339;;Congelado;Filezinho Sassami Cozido Sadia Na Receita 2kg -Caixa c/5
3;BRF - Sadia;Aves;7891515521400;;Congelado;Peito de Frango em Tiras s/ Pele e Osso Sadia na Receita 400g -Caixa c/12
3;BRF - Sadia;Aves;7891515521394;;Congelado;Peito de Frango em Cubos s/ Pele e Osso Sadia na Receita 400g -Caixa c/12
3;BRF - Sadia;Suínos;7891515521899;;Congelado;Ponta de Costela Suína Sadia Caixa 10kg
3;BRF - Sadia;Suínos;7891515521882;;Congelado;Copa Lombo Suína Sadia Caixa 12kg
3;BRF - Sadia;Suínos;7891515521875;;Congelado;Picanha Suína sem Osso Sadia Caixa 12kg
3;BRF - Sadia;Suínos;7891515521868;;Congelado;Patinho Suino Cong Iwp Pvar Sadia
4;BRF - Perdigăo;Suínos;7891515521851;;Congelado;Pernil Suino Cong Iwp Pvar Sadia
3;BRF - Sadia;Suínos;7891515521844;;Congelado;Coxăo Mole Suíno sem Osso Sadia Caixa 12Kg -Caixa c/1
3;BRF - Sadia;Suínos;7891515521837;;Congelado;Alcatra Suina Cong Iwp Pvar Sadia
4;BRF - Perdigăo;Suínos;7891515521110;;Congelado;Picanha Suína com Alho e Ervas Perdigăo Na Brasa Caixa 10Kg
4;BRF - Perdigăo;Suínos;7891515521035;;Congelado;Panceta Suína c/ Toque de Limăo Perdigăo Na Brasa Caixa 12,8kg
4;BRF - Perdigăo;Suínos;7891515521028;;Congelado;Costela Suína com Barbecue Perdigăo Na Brasa Caixa 9,9kg
3;BRF - Sadia;Suínos;7891515518424;;Resfriado;Linguiça Tipo Calabresa Defumada Sadia 1kg -Caixa c/18
4;BRF - Perdigăo;Suínos;7891515518516;;Resfriado;Linguiça Tipo Calabresa Defumada Perdigăo 1kg -Caixa c/18
4;BRF - Perdigăo;Aves;7891515517786;;Congelado;Tirinhas de Frango Empanadas Perdigăo 1kg -Caixa c/3
4;BRF - Perdigăo;Aves;7891515517779;;Congelado;Tirinhas de Frango Empanadas Perdigăo 300g -Caixa c/15
4;BRF - Perdigăo;Suínos;7891515496234;;Congelado;Lasanha Frango com Bacon Perdigăo 600g -Caixa c/6
3;BRF - Sadia;Aves;7891515515324;;Congelado;Filezinho Sassami de Frango Sadia Bio 1kg -Caixa c/12
3;BRF - Sadia;Aves;7891515515317;;Congelado;Coxinha da Asa de Frango Drumette Sadia Bio 1kg -Caixa c/12
3;BRF - Sadia;Aves;7891515515348;;Congelado;Filé de Peito de Frango sem Pele sem Osso Sadia Bio 1kg -Caixa c/12
3;BRF - Sadia;Aves;7891515515331;;Congelado;Meio da Asa de Frango Sadia Bio 1kg -Caixa c/12
3;BRF - Sadia;Suínos;7891515513719;;Congelado;Lombo Suíno In Natura Sadia 0,8 kg a 1,5 kg
4;BRF - Perdigăo;Aves;7891515513320;;Resfriado;Peito Peru Defumado Resfriado Perdigăo 2,6kg Caixa 5,2kg
4;BRF - Perdigăo;Aves;7891515513146;;Congelado;Filé de Peito de Frango s/ Pele s/ Osso Perdigăo 2kg -Caixa c/6
4;BRF - Perdigăo;Aves;7891515513139;;Congelado;Filé de Peito de Frango s/ Pele s/ Osso Perdigăo 1kg -Caixa c/16
4;BRF - Perdigăo;Aves;7891515404062;;Resfriado;Presunto de Peru Perdigăo 3,45kg -Caixa c/2
4;BRF - Perdigăo;Suínos;7891515511234;;Resfriado;Linguiça Tipo Calabresa Reta Defumada Perdigăo 2,5kg -Caixa c/3
4;BRF - Perdigăo;Outros;7891515510343;;Resfriado;Salsicha Hot-Dog sem Corante Perdigăo 500g -Caixa c/12
4;BRF - Perdigăo;Lanches;7891515936310;;Congelado;Fetuccini Com Molho Bolonhesa Congelado Perdigăo 350g -Caixa c/12
3;BRF - Sadia;Outros;7893000027701;;Congelado;Hot Pocket Sadia X-Burguer 145g -Caixa c/18
4;BRF - Perdigăo;Aves;7891515544584;;Congelado;Coxa Sobrecoxa de Frango s/ Osso e c/ Pele Perdigăo Caixa 15Kg
3;BRF - Sadia;Suínos;7893000024014;;Congelado;Linguiça Toscana Sadia 5kg -Caixa c/3
3;BRF - Sadia;Suínos;7893000023994;;Congelado;Linguiça de Carne Suína Sadia 5kg -Caixa c/3
3;BRF - Sadia;Suínos;7891515502256;;Congelado;Pernil Semi Desossado In Natura Sadia 4 kg a 5 kg
3;BRF - Sadia;Aves;7891515500023;;Congelado;Sobrecoxa de Frango Sadia Bio 1kg -Caixa c/12
4;BRF - Perdigăo;Aves;7891515498924;;Congelado;Sambiquira de Peru Perdigăo 2kg -Caixa c/8
4;BRF - Perdigăo;Aves;7891515498139;;Congelado;Asa Int Peru Itf Cong Perd Pvar
4;BRF - Perdigăo;Aves;7891515495817;;Congelado;Asa Tulipa Frango Perdigăo 1Kg -Caixa c/16
4;BRF - Perdigăo;Aves;7891515495404;;Congelado;Tulipa de Frango Perdigăo Food Service Caixa 15Kg -Caixa c/1
3;BRF - Sadia;Aves;7891515495435;;Congelado;Coxa de Frango Sadia Bio 1kg -Caixa c/12
4;BRF - Perdigăo;Aves;7891515495398;;Congelado;Asa de Frango Inteira Perdigăo Food Service Caixa 15Kg -Caixa c/1
3;BRF - Sadia;Suínos;7893000018778;;Congelado;Carré Suíno Congelado Sadia PVAR
3;BRF - Sadia;Aves;7891515494810;;Congelado;Coxa com Sobrecoxa de Frango sem Osso Sadia 1kg -Caixa c/12
4;BRF - Perdigăo;Lanches;7891515492960;;Congelado;Păo De Queijo Lanche Perdigăo 900G -Caixa c/10
4;BRF - Perdigăo;Lanches;7891515492946;;Congelado;Păo de Queijo Coquetel Congelado Perdigăo 375g -Caixa c/20
4;BRF - Perdigăo;Lanches;7891515492939;;Congelado;Păo de Queijo Tradicional Congelado Perdigăo 375g -Caixa c/20
3;BRF - Sadia;Aves;7891515493042;;Congelado;Linguiça de Frango Sadia 800g -Caixa c/12
4;BRF - Perdigăo;Suínos;7891515491314;;Resfriado;Bacon Cubos Food Service Perdigăo Caixa 4Kg
4;BRF - Perdigăo;Aves;7891515503659;;Congelado;Filezinho Sassami de Frango Perdigăo 1kg -Caixa c/16
3;BRF - Sadia;Suínos;7893000097926;;Resfriado;EMBUTIDO DE PERNIL COZ S/ CAPA GORDURA Sadia Food Service 3,5Kg -Caixa c/2
3;BRF - Sadia;Bovinos;7893000517059;;Congelado;Costela Suína Sadia Caixa 10 Kg -Caixa c/1
3;BRF - Sadia;Outros;7893000444904;;Resfriado;Apresuntado Sadia 3,5kg -Caixa c/2
3;BRF - Sadia;Suínos;7893000522213;;Congelado;Salame Pepperoni Fatiado Sadia 1kg -Caixa c/2
3;BRF - Sadia;Suínos;7893000528093;;Congelado;Lombo Temperado Sadia 1,1 kg a 1,5 kg
3;BRF - Sadia;Suínos;7893000526044;;Resfriado;Bacon Defumado Manta Sadia Peso Variável de 3 até 4kg -Caixa c/4
3;BRF - Sadia;Outros;7893000516915;;Congelado;Costelinha Suína CONG SD PVAR
5;BRF - Qualy;Margarinas;7893000502888;;Resfriado;Margarina Qualy Light/Zero Lactose com Sal 500g -Caixa c/12
3;BRF - Sadia;Aves;7893000532793;;Congelado;Sobrecoxa de Frango c/ Osso e Pele Sadia Food Service Caixa 15Kg -Caixa c/1
5;BRF - Qualy;Margarinas;7893000394117;;Resfriado;Margarina Qualy Cremosa com Sal 250g -Caixa c/24
5;BRF - Qualy;Margarinas;7893000383005;;Resfriado;Margarina Qualy Cremosa sem Sal 500g -Caixa c/12
3;BRF - Sadia;Suínos;7893000289758;;Resfriado;Salame Hamburguęs Fatiado Sadia Caixa 3Kg
3;BRF - Sadia;Suínos;7893000290259;;Resfriado;Salame Italiano Fatiado Sadia 100g -Caixa c/30
3;BRF - Sadia;Aves;7893000024007;;Congelado;Linguiça de Frango Sadia 5kg -Caixa c/3
3;BRF - Sadia;Suínos;7893000018761;;Congelado;Bisteca Suína Sadia 10kg -Caixa c/1
6;BRF - Deline;Margarinas;7893000012356;;Resfriado;Margarina Cremosa c/ Sal 60% de Lipídios Deline Balde 15kg
3;BRF - Sadia;Aves;7893000437104;;Congelado;Moela de Frango Sadia 1kg -Caixa c/12
3;BRF - Sadia;Aves;7893000488878;;Congelado;Coxinha da Asa de Frango Sadia 1kg -Caixa c/8
5;BRF - Qualy;Margarinas;7893000382961;;Resfriado;Margarina Qualy Cremosa sem Sal 250g -Caixa c/24
3;BRF - Sadia;Aves;7893000488526;;Congelado;Frango ŕ Passarinho Sadia 1kg -Caixa c/8
5;BRF - Qualy;Margarinas;7893000394209;;Resfriado;Margarina Qualy Cremosa com Sal 500g -Caixa c/12
3;BRF - Sadia;Suínos;7893000556706;;Resfriado;Copa Inteira Sadia Speciale Caixa 4,7kg
3;BRF - Sadia;Aves;7893000030183;;Congelado;Peru Tradicional Sadia 5 kg a 5,99 kg
3;BRF - Sadia;Suínos;7893000290174;;Resfriado;Copa Fatiado Sadia Speciale 100g -Caixa c/30
3;BRF - Sadia;Outros;7893000779501;;Congelado;Torta Mousse de Chocolate com Raspas Miss Daisy Caixa 470g -Caixa c/6
3;BRF - Sadia;Aves;7893000719279;;Resfriado;Salsicha de Frango Sadia 500g -Caixa c/12
3;BRF - Sadia;Aves;7893000696204;;Resfriado;Peito de Peru Defumado Sadia 2,6kg -Caixa c/2
3;BRF - Sadia;Suínos;7893000133075;;Resfriado;Linguiça Calabresa Defumada Guanabara Sadia 500g -Caixa c/10
3;BRF - Sadia;Outros;7893000106420;;Resfriado;Salsicha Hot-Dog Sadia 3kg -Caixa c/2
3;BRF - Sadia;Aves;7893000027718;;Congelado;Hot Pocket Sadia X-Frango 145g -Caixa c/18
3;BRF - Sadia;Outros;7893000094741;;Resfriado;Presunto Parma Sadia Speciale Caixa 7kg peça inteira -Caixa c/1
3;BRF - Sadia;Lanches;7893000632233;;Congelado;Pizza 4 Queijos Sadia 460g -Caixa c/12
3;BRF - Sadia;Lanches;7893000631939;;Congelado;Pizza Mussarela Sadia 440g -Caixa c/12
3;BRF - Sadia;Outros;7893000969032;;Congelado;Torta Holandesa Miss Daisy 470g -Caixa c/6
3;BRF - Sadia;Suínos;7893000973817;;Resfriado;Linguiça Tipo Calabresa Reta Defumada Sadia 2,5Kg -Caixa c/3
3;BRF - Sadia;Suínos;7893000001121;;Seco;Tender Suíno Desossado Sadia 1,2 kg
3;BRF - Sadia;Suínos;7893000650138;;Resfriado;Linguiça Tipo Calabresa Defumada Sadia 500g -Caixa c/10
3;BRF - Sadia;Suínos;7893000973909;;Resfriado;Linguiça Tipo Calabresa c/ Especiarias Sadia 2,5Kg -Caixa c/7,5
3;BRF - Sadia;Aves;7893000518025;;Congelado;Frango Inteiro Com miudos Sadia Caixa 18kg
3;BRF - Sadia;Aves;7893000482401;;Congelado;Filé de Peito de Frango Sadia 1kg -Caixa c/12
3;BRF - Sadia;Suínos;7893000521322;;Resfriado;Bacon Fatiado Sadia Na Receita 750g -Caixa c/6
3;BRF - Sadia;Aves;7893000863125;;Congelado;Filezinho Sassami de Frango Sadia 1kg -Caixa c/12
4;BRF - Perdigăo;Suínos;7891515490430;;Congelado;Lasanha Calabresa Perdigăo 600g -Caixa c/6
4;BRF - Perdigăo;Suínos;7891515490218;;Resfriado;Salame Defumado Fatiado Perdigăo 100g -Caixa c/30
4;BRF - Perdigăo;Outros;7891515489335;;Congelado;Mini Chicken Tradicional Perdigăo 3kg - Caixa com 2
3;BRF - Sadia;Suínos;7891515489106;;Congelado;Lombo Suíno Temperado Sadia Assa Fácil 750g
4;BRF - Perdigăo;Outros;7891515489328;;Congelado;Mini Chicken Queijo Perdigăo 3kg - Caixa com 2
3;BRF - Sadia;Suínos;7891515489069;;Congelado;Pernil Suíno Temperado Sadia Assa Fácil Caixa 6kg
3;BRF - Sadia;Aves;7891515488550;;Congelado;Coxa com Sobrecoxa de Frango sem Osso Sadia Bio 1kg -Caixa c/12
3;BRF - Sadia;Aves;7891515488536;;Congelado;Filé de Peito de Frango Sadia Bio 1kg -Caixa c/12
3;BRF - Sadia;Suínos;7891515489090;;Congelado;Picanha Suína Temperada Sadia Assa Fácil Caixa 6kg
4;BRF - Perdigăo;Aves;7891515496241;;Congelado;Lasanha Bolonhesa Perdigăo Tamanho Família - 1kg -Caixa c/4
4;BRF - Perdigăo;Aves;7891515486372;;Congelado;Coxinha da Asa de Frango Temperada Perdigăo Na Brasa 800g -Caixa c/9
4;BRF - Perdigăo;Aves;7891515486389;;Congelado;Sobrecoxa de Frango Temperada Perdigăo Na Brasa 800g -Caixa c/9
4;BRF - Perdigăo;Aves;7891515486945;;Congelado;Coxa com Sobrecoxa de Frango sem Osso Perdigăo 2kg -Caixa c/6
4;BRF - Perdigăo;Aves;7891515487416;;Congelado;Coraçăo de Frango Temperado Molho Shoyu Perdigăo Na Brasa 800g -Caixa c/9
3;BRF - Sadia;Lanches;7891515486846;;Congelado;Nuggets Tradicional Sadia Nuggets Embalagem Econômica 700g -Caixa c/6
3;BRF - Sadia;Aves;7891515486594;;Congelado;Coxa de Frango Temperada Sadia 1kg -Caixa c/8
9;BRF - Sofiteli;Margarinas;7893000012387;;Resfriado;Margarina com Sal 75% de Lidípio Sofiteli Balde 15kg -Caixa c/1
3;BRF - Sadia;Aves;7891515486587;;Congelado;Sobrecoxa de Frango Temperada Sadia 1kg -Caixa c/8
3;BRF - Sadia;Aves;7891515486747;;Congelado;Filé de Peito de Frango Temperado sem Pele sem OssoSadia 1kg -Caixa c/8
4;BRF - Perdigăo;Aves;7891515487171;;Congelado;Peito de Frango Sem Pele Perdigăo Caixa 15Kg -Caixa c/1
4;BRF - Perdigăo;Suínos;7891515485146;;Congelado;Linguiça Toscana com Pimenta-Biquinho Perdigăo Na Brasa 600g -Caixa c/12
4;BRF - Perdigăo;Suínos;7891515485139;;Congelado;Linguiça Toscana com Queijo Coalho Perdigăo Na Brasa 600g -Caixa c/12
4;BRF - Perdigăo;Suínos;7891515485122;;Congelado;Linguiça de Frango com Bacon Perdigăo Na Brasa 600g -Caixa c/12
4;BRF - Perdigăo;Suínos;7891515485115;;Congelado;Linguiça Toscana com Alho e Ervas Perdigăo Na Brasa 600g -Caixa c/12
3;BRF - Sadia;Aves;7893000073142;;Congelado;Lasanha Bolonhesa Sadia Embalagem Econômica - 1kg -Caixa c/4
3;BRF - Sadia;Aves;7893000073166;;Congelado;Lasanha Quatro Queijos Sadia Embalagem Econômica - 1kg -Caixa c/4
4;BRF - Perdigăo;Outros;7891515484040;;Resfriado;Presunto Cozido Fatiado Perdigăo 200g -Caixa c/20
3;BRF - Sadia;Aves;7893000674073;;Congelado;Lasanha Quatro Queijos Sadia 350g -Caixa c/12
4;BRF - Perdigăo;Aves;7891515443528;;Congelado;Frango ŕ Parmegiana Perdigăo 0,8Kg -Caixa c/4
3;BRF - Sadia;Aves;7893000674233;;Congelado;Lasanha Bolonhesa Sadia 350g -Caixa c/12
3;BRF - Sadia;Outros;7893000902633;;Congelado;Yakissoba Sadia 600g -Caixa c/6
3;BRF - Sadia;Aves;7893000069374;;Congelado;Strogonoff Frango Sadia 500g -Caixa c/6
3;BRF - Sadia;Aves;7893000492394;;Congelado;Frango ŕ Parmegiana Sadia 500g -Caixa c/6
3;BRF - Sadia;Aves;7891515475642;;Congelado;Lasanha Frango Sadia 600g -Caixa c/6
3;BRF - Sadia;Aves;7891515475697;;Congelado;Lasanha Presunto e Queijo ao Sugo Sadia 600g -Caixa c/6
3;BRF - Sadia;Aves;7891515476212;;Congelado;Lasanha Peito de Peru Sadia 600g -Caixa c/6
3;BRF - Sadia;Aves;7893000005976;;Congelado;Sobrecoxa de Frango Sadia 1kg -Caixa c/12
3;BRF - Sadia;Suínos;7891515476229;;Congelado;Lasanha Calabresa Sadia 600g -Caixa c/6
3;BRF - Sadia;Aves;7891515475703;;Congelado;Lasanha Bolonhesa Sadia 600g -Caixa c/6
3;BRF - Sadia;Aves;7893000005969;;Congelado;Coxa de Frango Sadia 1kg -Caixa c/12
3;BRF - Sadia;Aves;7893000005945;;Congelado;Filé de Peito de Frango sem Pele sem Osso Sadia 1kg -Caixa c/12
3;BRF - Sadia;Outros;7893000004832;;Resfriado;Mortadela Defumada Sadia 5,1Kg -Caixa c/2
3;BRF - Sadia;Lanches;7893000949355;;Congelado;Nuggets Tradicional Sadia 300g -Caixa c/16
3;BRF - Sadia;Lanches;7893000949270;;Congelado;Nuggets Crocante Sadia 300g -Caixa c/16
4;BRF - Perdigăo;Outros;7891515485535;;Congelado;Mini Chicken de Queijo Perdigăo 275g -Caixa c/15
4;BRF - Perdigăo;Outros;7891515485528;;Congelado;Mini Chicken Tradicional Perdigăo 275g -Caixa c/15
3;BRF - Sadia;Lanches;7893000949430;;Congelado;Nuggets com Queijo Sadia 300g -Caixa c/16
3;BRF - Sadia;Aves;7891515482015;;Congelado;Medalhăo De Peru Sem Osso e Pele Food Service Sadia 2Kg -Caixa c/4
3;BRF - Sadia;Aves;7891515475680;;Congelado;Lasanha Quatro Queijos Sadia 600g -Caixa c/6
4;BRF - Perdigăo;Aves;7891515496357;;Congelado;Lasanha Bolonhesa Perdigăo 600g -Caixa c/6
3;BRF - Sadia;Suínos;7899638313070;;Resfriado;Pernil Cordeiro Mamăo Nirea
3;BRF - Sadia;Outros;7899638309059;;Resfriado;Cordeiro Paleta Mamăo Importado Nirea
3;BRF - Sadia;Suínos;7893000002104;;Seco;Pernil Desossado Temperado Sadia 2,4 kg a 3,6 kg
3;BRF - Sadia;Outros;7893000084605;;Resfriado;Banha Sadia 1kg -Caixa c/18
3;BRF - Sadia;Suínos;7891515479558;;Resfriado;Snack Salamitos Sabor Pepperoni Sadia 36g -Caixa c/50
3;BRF - Sadia;Suínos;7891515479541;;Resfriado;Snack Salamitos Sabor Limăo Sadia 36g -Caixa c/50
4;BRF - Perdigăo;Aves;7891515016715;;Resfriado;Peito de Frango Defumado Perdigăo 2,6Kg -Caixa c/2
4;BRF - Perdigăo;Outros;7891515437411;;Resfriado;Ingredientes para Feijoada Perdigăo 880g -Caixa c/15
3;BRF - Sadia;Suínos;7891515437015;;Resfriado;Snack Salamitos Tradicional Sadia 36g -Caixa c/50
3;BRF - Sadia;Suínos;7893000091641;;Resfriado;Bacon Defumado Fatiado Sadia Na Receita 250g -Caixa c/20
3;BRF - Sadia;Suínos;7891515560492;;Congelado;Costela Suina Temperada Sadia Assa Fácil Sadia Caixa 9,9kg
4;BRF - Perdigăo;Aves;7891515478254;;Congelado;Coxa e Sobrecoxa de Frango Iscas c/ pele s/ osso Perdigăo 2kg -Caixa c/6
3;BRF - Sadia;Outros;7891515431587;;Resfriado;Mortadela Defumada Fatiado Soltíssimo Sadia 200G -Caixa c/21
5;BRF - Qualy;Margarinas;7891515560782;;Seco;Păo De Queijo Amanteigado Lanche Qualy 900G -Caixa c/10
5;BRF - Qualy;Margarinas;7891515560775;;Seco;Păo De Queijo Amanteigado Qualy 375G -Caixa c/20
4;BRF - Perdigăo;Outros;7891515435134;;Seco;Apresuntado Fatiado Perdigăo 200g -Caixa c/20
